{
  "schema_version": 1,
  "run_id": "book-01-2026-09-13-r1",
  "project_id": "riokka",
  "book_id": "book-01",
  "source_sha256": "2651e6b73fe20e844ff19c4f7f99a39ca90c1da3d53f91a3a3a1417ce3ac4172",
  "status": "verified",
  "items": [
    {
      "id": "ENS-001",
      "category": "causality",
      "severity": "major",
      "certainty": "strong_inference",
      "agreement": "convergent",
      "locations": [
        {
          "chapter": 22,
          "anchor": "p765 in source snapshot",
          "quote": "Можно было потребовать автомат, положить его за ворота и увести парня с нами."
        },
        {
          "chapter": 25,
          "anchor": "p843 in source snapshot",
          "quote": "Из-за того, что я счел опущенный ствол безопасным."
        },
        {
          "chapter": 27,
          "anchor": "p883 in source snapshot",
          "quote": "Был ещё автомат, который я мог забрать."
        }
      ],
      "observation": "Кай сознательно не забирает доступный заряженный автомат у нестабильного охранника, хотя отвечает за беспомощную группу; поздняя трагедия поэтому зависит от очевидной профессиональной ошибки.",
      "reader_effect": "Два слепых прогона перестали верить компетентности героя и увидели авторскую подготовку смерти Лины вместо неразрешимого морального выбора.",
      "evidence": "Gemini Pro/Flash сходятся на главе 22; прямые формулировки глав 22, 25 и 27 подтверждают доступность простого хода. Прежняя проверка 42/42 видела ход, но оценивала его как намеренную ошибку; новые читательские данные меняют редакторский вывод.",
      "proposed_actions": [
        "Сделать охранника физически недоступным в аварийном посту и связать его состояние с открытием ворот.",
        "Показать, что Кай разряжает автомат и забирает магазин.",
        "После вынужденного возврата показать новый магазин и осознанный последний шанс, который Кай оставляет охраннику.",
        "Обновить самооценку Кая в главах 26–27 без изменения смерти Лины."
      ],
      "dependencies": [
        "chapters 22, 23, 25, 26, 27",
        "Lina death causality",
        "Kai professional competence",
        "Book 2 memory of Semari",
        "working revision continuity"
      ],
      "author_decision": {
        "status": "modified",
        "basis": "Автор 2026-09-13 поручил переписать необходимые места книги 1 по совокупности аудитов и делегировал редакторский выбор; принят ограниченный вариант, сохраняющий смерть Лины и устраняющий профессиональную нелепость.",
        "decided_at": "2026-09-13"
      },
      "implementation": {
        "status": "applied",
        "targets": [
          "chapters 22, 23, 25, 26, 27",
          "revisions/2026-09-13-ensemble-r1/revised.docx",
          "revisions/2026-09-13-ensemble-r1/continuity/"
        ],
        "revision_sha256": "bb2b68f7d92d7cb25bd426bc7761d8ee7524e60c3f61e47ba7497c7215cf2116",
        "change_log": "revisions/2026-09-13-ensemble-r1/ALL-CHANGES.md"
      },
      "verification": {
        "status": "passed",
        "evidence": {
          "report": "revisions/2026-09-13-ensemble-r1/audit/REPORT.md",
          "candidate_sha256": "bb2b68f7d92d7cb25bd426bc7761d8ee7524e60c3f61e47ba7497c7215cf2116",
          "anchors": "50/50",
          "mechanical_signals": 0,
          "docx_structure": "passed",
          "render": "not_run_no_available_renderer"
        }
      },
      "origin_reports": [
        "astra",
        "gemini"
      ]
    }
  ]
}
